{
  "$schema": "./_schema.json",
  "id": "crane-up",
  "name": "Crane Up",
  "category": "jib",
  "description": "Big sweeping rise with a gentle push forward.",
  "prompt_template": "{scene} A sweeping crane shot: the camera rises high and steadily while pushing forward, tilting down to unveil the full scale of the scene. {lens} {mood}",
  "negative": "camera shake, jitter, warping, morphing, flicker, scene cut, text, watermark",
  "duration": 5,
  "lora": null,
  "virtual_camera": {
    "keys": [
      {
        "t": 0
      },
      {
        "t": 1,
        "up": 1.5,
        "forward": 0.9,
        "pitch": -5.0
      }
    ],
    "ease": "inout"
  },
  "engines": {
    "workflow": {
      "workflow": "ltx2_i2v_camera",
      "params": {
        "lora_strength": 0.0,
        "cfg": 4.0
      }
    },
    "router": {
      "model": "minimax/minimax-h3",
      "alternates": [
        "byteplus/dreamina-seedance-2-5-260628",
        "xai/grok-imagine-video-1.5-lite"
      ],
      "body_overrides": {}
    }
  }
}
