{
  "$schema": "./_schema.json",
  "id": "dolly-zoom",
  "name": "Dolly Zoom",
  "category": "special",
  "description": "Vertigo effect: background stretches while subject stays.",
  "prompt_template": "{scene} A dolly zoom (vertigo effect): the camera moves forward while the lens widens, the background stretching and warping behind the steady subject. {lens} {mood}",
  "negative": "camera shake, jitter, warping, morphing, flicker, scene cut, text, watermark",
  "duration": 5,
  "lora": null,
  "virtual_camera": {
    "keys": [
      {
        "t": 0
      },
      {
        "t": 1,
        "forward": 1.5,
        "zoom": 0.72
      }
    ],
    "ease": "inout"
  },
  "engines": {
    "workflow": {
      "workflow": "ltx2_i2v_camera",
      "params": {
        "lora_strength": 0.0,
        "cfg": 4.0
      }
    },
    "router": {
      "model": "minimax/minimax-h3",
      "alternates": [
        "byteplus/dreamina-seedance-2-5-260628",
        "xai/grok-imagine-video-1.5-lite"
      ],
      "body_overrides": {}
    }
  }
}
