{
  "$schema": "./_schema.json",
  "id": "whip-pan",
  "name": "Whip Pan",
  "category": "special",
  "description": "Fast pan with heavy motion blur.",
  "prompt_template": "{scene} The camera whip-pans quickly to the side with heavy motion blur, the frame smearing across the scene before settling. {lens} {mood}",
  "negative": "camera shake, jitter, warping, morphing, flicker, scene cut, text, watermark",
  "duration": 5,
  "lora": null,
  "virtual_camera": {
    "keys": [
      {
        "t": 0
      },
      {
        "t": 1,
        "yaw": -11.0
      }
    ],
    "ease": "snap",
    "motion_blur": 4
  },
  "engines": {
    "workflow": {
      "workflow": "ltx2_i2v_camera",
      "params": {
        "lora_strength": 0.0,
        "cfg": 4.0
      }
    },
    "router": {
      "model": "minimax/minimax-h3",
      "alternates": [
        "byteplus/dreamina-seedance-2-5-260628",
        "xai/grok-imagine-video-1.5-lite"
      ],
      "body_overrides": {}
    }
  }
}
